master_id	canonical_name	layer	proposer	source_text_ids	aliases	evidence_pro	evidence_con	status	notes
HYP-001	縄文海進記憶仮説	L5	在野研究者(複数)	-	海面上昇記憶仮説	縄文期の海面上昇に対応する遺跡分布の偏り(間接的)	数千年隔たった神話への記憶伝達は実証困難	在野・愛好家層で言及される	神話の長期記憶モデルの極端版。検証困難
HYP-002	ヤマタノオロチ製鉄民征服譚説	L4	谷川健一|小川光暘ほか	-	製鉄民移動仮説|ヤマタノオロチ=製鉄説	斐伊川流域=砂鉄産地、オロチの「目赤=溶鉄」「尾から鉄剣」モチーフ、奥出雲のたたら文化	古代の在地製鉄炉の確実証拠不在(IZM-094)	学術論考はあるが主流ではない	大胆仮説と学術仮説の境界例。L2 と L4 の二重評価
HYP-003	弥生期出雲広域政治連合仮説	L2	渡辺貞幸|瀧音能之ほか	-	出雲広域連合仮説|出雲王国仮説	荒神谷358銅剣|加茂岩倉39銅鐸|西谷墳墓群|四隅突出型墳丘墓の独自展開(IZM-004,005,006,007,008,100)	文献記録の欠如(古事記・書紀は出雲王国を語らない)	考古学界では一定の支持。歴史学界では懐疑的	ヤマト王権成立前の地域政治圏の存在を主張
HYP-004	国譲り政治史仮説	L2	津田左右吉|岡田精司|瀧音能之	-	国譲り神話=政治史的読解仮説|出雲祭祀権収奪説	銅鐸祭祀終焉(IZM-009)|出雲国造神賀詞の朝貢的構造(IZM-079)|6-7世紀のヤマト王権伸長との対応	神話の編纂年代(8世紀)と推定される史実(3-6世紀)の隔たり	学術界の主要解釈の一つ	IZM-060 と接続。出雲編全体の背景仮説
HYP-005	大物主大国主同体説	L2	古事記原典|本居宣長以来	古事記	-	古事記の「幸魂奇魂」記述、出雲国造神賀詞での御諸山祀り	書紀本文では別神扱い	古来の有力解釈、近代も支持	IZM-040, DEI-014 連結
HYP-006	翡翠ロード仮説	L3	寺村光晴|藤田富士夫	-	出雲—諏訪—越翡翠交易説	糸魚川産翡翠の出雲・諏訪遺跡からの出土、ヌナカワヒメ・タケミナカタ神話の地理的整合	直接交易か中継交易か区別不能	考古学的傍証は強いが、神話との対応はL3	IZM-013, IZM-072 連結
HYP-007	スサノオ新羅渡来説	L4	書紀一書|近代神話学者	日本書紀	スサノオ朝鮮半島渡来説	書紀一書の「新羅曽尸茂梨経由」記述、韓竈神社等の古社名、出雲の朝鮮半島交流	古事記には欠落、編纂段階の挿入の可能性	近代神話学・在野研究で言及	IZM-019, IZM-145 連結
HYP-008	出雲国造神賀詞=出雲側視点の再構成説	L1	近代研究の一般的解釈	続日本紀|延喜式	-	アメノホヒを忠臣とする肯定的描写、御子神を皇都守護に配置する独自構成	-	学界の標準解釈	IZM-078, IZM-079 連結
